{
  "schema": 1,
  "id": "g_b1a570a3",
  "slug": "gyroscope-fidget",
  "title": {
    "en": "Gyroscope Fidget",
    "tr": "Jiroskop Fidget"
  },
  "summary": {
    "en": "Three nested rings and a Seljuk-star centre on cone pins, printed in place as one piece; the stand prints separately. Set print_layout = True for the plate layout.",
    "tr": "İç içe üç halka ve Selçuklu yıldızlı merkez konik pimlerle bağlı; tek parça print-in-place basılır, taban ayrı basılır. Tabla yerleşimi için print_layout = True."
  },
  "tags": [
    "fidget",
    "gyroscope",
    "print-in-place",
    "seljuk-star"
  ],
  "category": "toys",
  "source": {
    "kind": "mcp",
    "client": "Claude Code"
  },
  "author": {
    "display": "Argil Design",
    "uid_hash": null
  },
  "license": "CC-BY-NC-SA-4.0",
  "copyright": "2026 Argil Design",
  "ai_training": "allowed",
  "consent": {
    "showcase": true,
    "prompt": false,
    "terms_version": "owner",
    "recorded": "2026-10-23"
  },
  "derived_from": null,
  "engine": {
    "python": "3.12",
    "build123d": "0.11.1",
    "ocp": "7.9.3.1.1",
    "bd_warehouse": "0.2.0"
  },
  "params": [
    {
      "name": "print_layout",
      "default": false,
      "label": {
        "en": "plate layout",
        "tr": "baskı yerleşimi"
      }
    },
    {
      "name": "R1",
      "default": 30.0,
      "min": 20,
      "max": 60,
      "unit": "mm",
      "label": {
        "en": "outer ring radius",
        "tr": "dış halka yarıçapı"
      }
    },
    {
      "name": "clearance",
      "default": 0.35,
      "min": 0.2,
      "max": 0.6,
      "unit": "mm",
      "label": {
        "en": "print-in-place clearance",
        "tr": "print-in-place boşluğu"
      }
    }
  ],
  "metrics": {
    "bbox": [
      86.0,
      45.413,
      68.641
    ],
    "volume": 29659.332,
    "area": 21870.84,
    "face_count": 113,
    "edge_count": 237,
    "vertex_count": 151,
    "parts": [
      {
        "name": "stand",
        "label": "stand",
        "path": [
          "gyroscope"
        ],
        "volume": 9110.591
      },
      {
        "name": "frame",
        "label": "frame",
        "path": [
          "gyroscope"
        ],
        "volume": 7184.407
      },
      {
        "name": "ring_1",
        "label": "ring_1",
        "path": [
          "gyroscope"
        ],
        "volume": 4123.905
      },
      {
        "name": "ring_2",
        "label": "ring_2",
        "path": [
          "gyroscope"
        ],
        "volume": 3443.229
      },
      {
        "name": "ring_3",
        "label": "ring_3",
        "path": [
          "gyroscope"
        ],
        "volume": 2765.433
      },
      {
        "name": "centre",
        "label": "centre",
        "path": [
          "gyroscope"
        ],
        "volume": 3031.767
      }
    ],
    "build_ms": 2324
  },
  "fingerprint": {
    "code_norm_sha256": "73ed872ed8ba02d0252d4264852786bf9f7b8f27331f2971f235566d9c7e69a8",
    "geom": [
      0.5281,
      0.7982,
      0.1106,
      22.8257,
      4.7362,
      1.9459
    ]
  },
  "print": {
    "printed": true,
    "grams": 22.96,
    "print_in_place": true,
    "notes": "Rings print flat in one piece with the frame; no supports. The stand prints separately."
  },
  "media": [
    {
      "file": "model.glb",
      "kind": "model",
      "renderer": "argilcad@1.0.10"
    },
    {
      "file": "media/thumb.webp",
      "kind": "thumb",
      "view": "iso",
      "look": "materials",
      "size": [
        512,
        512
      ],
      "renderer": "model-viewer@4.3.1"
    },
    {
      "file": "media/og.jpg",
      "kind": "og",
      "view": "iso",
      "look": "materials",
      "size": [
        1200,
        630
      ],
      "renderer": "model-viewer@4.3.1"
    },
    {
      "file": "media/turntable.webp",
      "kind": "turntable",
      "look": "materials",
      "size": [
        480,
        480
      ],
      "frames": 36,
      "fps": 7.2,
      "renderer": "model-viewer@4.3.1"
    },
    {
      "file": "media/iso.png",
      "kind": "view",
      "view": "iso",
      "look": "plain",
      "size": [
        512,
        512
      ],
      "camera": {
        "dir": [
          1,
          -1,
          1
        ],
        "fit": "bbox",
        "projection": "perspective"
      },
      "renderer": "argilcad@1.0.10"
    },
    {
      "file": "media/front.png",
      "kind": "view",
      "view": "front",
      "look": "plain",
      "size": [
        512,
        512
      ],
      "camera": {
        "dir": [
          0,
          -1,
          0
        ],
        "fit": "bbox",
        "projection": "perspective"
      },
      "renderer": "argilcad@1.0.10"
    },
    {
      "file": "media/top.png",
      "kind": "view",
      "view": "top",
      "look": "plain",
      "size": [
        512,
        512
      ],
      "camera": {
        "dir": [
          0,
          0,
          1
        ],
        "fit": "bbox",
        "projection": "perspective"
      },
      "renderer": "argilcad@1.0.10"
    },
    {
      "file": "media/right.png",
      "kind": "view",
      "view": "right",
      "look": "plain",
      "size": [
        512,
        512
      ],
      "camera": {
        "dir": [
          1,
          0,
          0
        ],
        "fit": "bbox",
        "projection": "perspective"
      },
      "renderer": "argilcad@1.0.10"
    }
  ],
  "created": "2026-10-09",
  "verified": {
    "date": "2026-10-23",
    "build123d": "0.11.1"
  }
}
